{
  "schemaVersion": "limitless.query/0.1",
  "taskKind": "redact-structured-agent-event",
  "receiver": {
    "constraints": ["language:python", "data:json-like", "execution:local"],
    "toolchain": {"python": "3.12"}
  },
  "requestedUse": "evaluation",
  "tenantScope": "public",
  "evaluatedAt": "2026-08-11T12:00:00Z"
}
